{
  "definitions": {
    "region": {
      "type": ["object", "null"],
      "title": "The Region Schema",
      "required": [
        "title",
        "start",
        "end"
      ],
      "properties": {
        "title": {
          "type": "string",
          "title": "The Title Schema",
          "examples": [
            "SAKURAï¼ŠBLOOMING PARTY!"
          ],
          "pattern": "^(.*)$"
        },
        "start": {
          "type": "string",
          "title": "The Start Schema",
          "examples": [
            "2017-03-24"
          ],
          "pattern": "^\\d{4}-\\d{2}-\\d{2}$"
        },
        "end": {
          "type": "string",
          "title": "The End Schema",
          "examples": [
            "2017-03-30"
          ],
          "pattern": "^\\d{4}-\\d{2}-\\d{2}$"
        }
      }
    },
    "meta": {
      "type": ["object", "null"],
      "title": "The Meta Schema",
      "properties": {
        "attribute": {
          "type": "string",
          "examples": [
            "pure"
          ],
          "enum": ["pure", "cool", "happy", "powerful"]
        },
        "dreamFestival": {
          "type": "object",
          "properties": {
            "linkId": {
              "type": "string"
            }
          }
        }
      }
    }
  },
  "$schema": "http://json-schema.org/draft-07/schema#",
  "$id": "http://example.com/root.json",
  "type": "array",
  "title": "The Root Schema",
  "items": {
    "$id": "#/items",
    "type": "object",
    "title": "The Items Schema",
    "required": [
      "linkId",
      "meta",
      "type",
      "region"
    ],
    "properties": {
      "linkId": {
        "$id": "#/items/properties/linkId",
        "type": ["string", "null"],
        "title": "The Linkid Schema",
        "examples": [
          "Sakura_Blooming_Party!"
        ]
      },
      "meta": {
        "$ref": "#/definitions/meta"
      },
      "type": {
        "type": "string",
        "title": "The Type Schema",
        "examples": [
          "normal"
        ],
        "enum": ["normal", "challenge", "versus", "try", "mission"]
      },
      "region": {
        "$id": "#/items/properties/region",
        "type": "object",
        "title": "The Region Schema",
        "required": [
          "japan",
          "taiwan",
          "korea",
          "global",
          "china"
        ],
        "properties": {
          "japan": {
            "$ref": "#/definitions/region"
          },
          "taiwan": {
            "$ref": "#/definitions/region"
          },
          "korea": {
            "$ref": "#/definitions/region"
          },
          "global": {
            "$ref": "#/definitions/region"
          },
          "china": {
            "$ref": "#/definitions/region"
          }
        }
      }
    }
  }
}
